uri	DNU	fileName	placeType	abstract.en	idno	idno	desc1.ar	sourceURI.desc1.ar	pages.desc1.ar	desc2.ar	sourceURI.desc2.ar	pages.desc2.ar	desc3.ar	sourceURI.desc3.ar	pages.desc3.ar	desc4.syr	sourceURI.desc4.syr	pages.desc4.syr	desc5.syr	sourceURI.desc5.syr	pages.desc5.syr	desc6.syr	sourceURI.desc6.syr	pages.desc6.syr	nameHeadword.en	name1.en	name2.en	name3.en	name4.en	name5.en	name6.en	name7.en	name8.en	name9.en	name10.en	name11.en	name12.en	nameHeadword.ar	name13.ar	name14.ar	name15.ar	name16.ar	name17.ar	sourceURI.name17	pages.name17	name18.ar	sourceURI.name18	pages.name18	name19.ar	sourceURI.name19	pages.name19	name20.ar	sourceURI.name20	pages.name20	name21.ar	sourceURI.name21	pages.name21	name22.ar	sourceURI.name22	pages.name22	name23.syr	sourceURI.name23	pages.name23	name24.syr	sourceURI.name24	pages.name24	name25.la	sourceURI.name25	pages.name25	name26.fr	sourceURI.name26	pages.name26	name27.fr	sourceURI.name27	pages.name27
5249	1	5249D1	settlement	A village in al-ʿIrāq that is now “a ruined site 9 miles S.W. of the town of Ḥilla on the Euphrates, about 12 miles S.S.W. of Babylon on the eastern shore of the Lake of Hindiyya.” (Herzfeld)	http://pleiades.stoa.org/places/893964																				Burṣ 	Borsippa 	Birs Nimrūd											بُرص					بُرص	http://syriaca.org/bibl/QVIUC5ZC	117																														
5250	1	5250D1	province	A province (probably in the south of Afghanistan) containing the cities of Jahālakān, Bān, Qarma, Būzād, Arḍ Dāwār, Ṣirūstān, Qarya al-Jawz, Rakhūd, Bakrāwādh, Banjawā, Kishsh, Rūdhān, Sifinjāwī, and Taliqān as well as 1,100 villages.			واما بست فانها اسم القصبة ايضا ومن مدنها جهالكان، بان، قرمة، بوزاد، ارض داور، صروستان، قرية الجوز، رخود، بكراواذ، بنجوى، كش، روذان، سفنجاوى، طلقان ولها الف ومائة قرية ومن هذه المدن ما يضاف الى سجستان وهو خطأ واقل من يميزهن تمييزنا وابو زيد جعل غزنين وبست من سجستان ومن الناس من يجعلهما كورة واحدة ويسميها كابلستان.	http://syriaca.org/bibl/Q7SV98GA	297																Bust													بست					بست	http://syriaca.org/bibl/Q7SV98GA	297																														
5251	1	5251D1	settlement	The metropolis of the province of Bust in southern Afghanistan.	http://sws.geonames.org/1134720		واما بست فانها اسم القصبة ايضا ومن مدنها جهالكان، بان، قرمة، بوزاد، ارض داور، صروستان، قرية الجوز، رخود، بكراواذ، بنجوى، كش، روذان، سفنجاوى، طلقان ولها الف ومائة قرية ومن هذه المدن ما يضاف الى سجستان وهو خطأ واقل من يميزهن تمييزنا وابو زيد جعل غزنين وبست من سجستان ومن الناس من يجعلهما كورة واحدة ويسميها كابلستان.	http://syriaca.org/bibl/Q7SV98GA	297																Bust													بست					بست	http://syriaca.org/bibl/Q7SV98GA	297																														
5252	1	5252D1	building	A building in Medina.																					Dār Abī Bakr al-Ṣiddīq													دار أبي يكر الصديق					دار أبي يكر الصديق	http://syriaca.org/bibl/WDUISTPU	115, 194																														
5253	1	5253D1	building	A building in Mecca.																					Dār al-Khayzurān													دار الخيزران					دار الخيزران	http://syriaca.org/bibl/WDUISTPU	115, 167																														
5254	1	5254D1	building	A building in Mecca.																					Dār al-Miknāsī al-Faqīh													دار المكناسي					دار المكناسي	http://syriaca.org/bibl/WDUISTPU	106																														
5255	1	5255D1	building	A building in Mecca.																					Dār al-Nadwa													دار الندوة					دار الندوة	http://syriaca.org/bibl/WDUISTPU	90, 91, 105, 181																														
5256	1	5256D1	building	A building in Mecca.																					Dār al-Qāḍī													دار القاضي					دار القاضي	http://syriaca.org/bibl/WDUISTPU	104																														
5257	1	5257D1	building	A building in Medina.																					Dār al-Ṣifa													دار الصفة					دار الصفة	http://syriaca.org/bibl/WDUISTPU	197																														
5258	1	5258D1	building	A building in Mecca built by ʿAbd Allāh b. al-Zubayr.																					Dār al-ʿAjala													دار العجلة					دار العجلة	http://syriaca.org/bibl/WDUISTPU	104, 105																														
5259	1	5259D1	building	A building in Medina.																					Dār Banī al-Najjār													دار بني النجار					دار بني النجار	http://syriaca.org/bibl/WDUISTPU	197																														
5260	1	5260D1	building	A building in Mecca.																					Dār Jaʿfar bin Abī Ṭālib													دار جعفر بن أبي طالب					دار جعفر بن أبي طالب	http://syriaca.org/bibl/WDUISTPU	115																														
5261	1	5261D1	building	A building in Mecca.																					Dār Khadīja													دار خديجة					دار خديجة	http://syriaca.org/bibl/WDUISTPU	114, 116, 163																														
5262	1	5262D1	building	A building in Mecca.																					Dār Zubayda													دار زبيدة					دار زبيدة	http://syriaca.org/bibl/WDUISTPU	104																														
5263	1	5263D1	building	A building in Medina.																					Dār ʿAbdallāh bin ʿUmar													دار عبد الله بن عمر					دار عبد الله بن عمر	http://syriaca.org/bibl/WDUISTPU	194																														
5264	1	5264D1	building	A building in Medina.																					Dār ʿĀʾisha													دار عائشة					دار عائشة	http://syriaca.org/bibl/WDUISTPU	197																														
5265	1	5265D1	building	A building in Medina.																					Dār ʿUmar bin al-Khaṭṭāb													دار عمر بن الخطاب					دار عمر بن الخطاب	http://syriaca.org/bibl/WDUISTPU	194																														
5266	1	5266D1	building	A building in Medina.																					Dār ʿUthmān													دار عثمان					دار عثمان	http://syriaca.org/bibl/WDUISTPU	195																														
5267	1	5267D1	mountain	Probably a mountain located in the sea along the coast of Oman.																					Dardūr													دردور					دردور	http://syriaca.org/bibl/BAEZEC37	vol.1, p.378																														
5268	1	5268D1	settlement	A city in Sijistān/Sistān province.			واما سجستان فانها كورة متصلة العمارة، منقطعة المساكن، قليلة المدن، كثيرة القصور، ومعدن النخيل والحيات. قصبتها زرنج ومن مدنها كوين، زنبوك، فره، درهند، قرنين، كواربواذا، بارنواذ، كزه، سنج، باب الطعام، كروادكن نه، الطاق.	http://syriaca.org/bibl/Q7SV98GA	297																Darhand													درهند					درهند	http://syriaca.org/bibl/Q7SV98GA	297																														
5269	1	5269D1	island	An island on the coast of Bahrain.	https://mapper.acme.com/?ll=26.540066,50.083585&z=11&t=M&marker0=26.540066,50.083585,ميناء%20دارين																				Dārīn													دارِين					دارين	http://syriaca.org/bibl/4ELQNR8R	839																														
5270	1	5270D1	settlement	A main seaport in the al-Baḥrayn renowned for its import of musk from India.	https://mapper.acme.com/?ll=26.540066,50.083585&z=11&t=M&marker0=26.540066,50.083585,ميناء%20دارين		دارين: فرضة بالبحرين يجلب إليها المسك من الهند، والنسبة إليها داري؛ قال الفرزدق : كأن تريكة من ماء مزن وداري الذكي من المدام. وفي كتاب سيف : أن المسلمين افتحموا إلى دارين البحر مع العلاء بن الحضرمي فأجازوا ذلك الخليج بإذن الله جميعا يمشون على مثل رملة ميثاء فوقها ماء يغمر أخفاف الإبل، وإن ما بين الساحل ودارين مسيرة يوم وليلة لسفر البحر في بعض الحالات، فالتقوا وقتلوا وسبوا فبلغ منهم الفارس ستة آلاف والراجل ألفين [...]	http://syriaca.org/bibl/ZQCZ554T	vol. 2, p. 432																Dārīn													دارِين					دارين	http://syriaca.org/bibl/ZQCZ554T	vol. 2, p. 432																														
5271	1	5271D1	settlement	“[T]he Edrei of the Bible, to-day Derʿa, chief town of Ḥawrān, 106 km. south of Damascus. Situated on the borderline between a basaltic region and the desert, the town, formerly renowned for its wine and oil, was always a great market for cereals and an important centre of trade routes.” (F. Buhl and N. Elisséeff)	http://pleiades.stoa.org/places/678002		وجنوبيها [من ديار العرب] وشيء من غربيهاثم يمتد عليها من ايلة على مدائن قوم لوط والبحيرة المنتنة التي تعرف ببحيرة زغر الى الشراة والبلقاء وهي من عمل فلسطين وأذرعات وحوران والبثنية والغوطة ونواحى بعلبك وذلك من عمل دمشق	http://syriaca.org/bibl/GZIUD38F	17																ِDarʿā 	Adhriʿāt												أذرعات 	درعا				اذرعات	http://syriaca.org/bibl/GZIUD38F	17																														
5272	1	5272D1	open-water	“Between the steep and barren slopes of the “desert of Judah” and the mountainous land of Moab lies the Dead Sea, like a blue mirror 1150 feet below sea-level from north to south. Its length is about 50 miles, its midbreadth 8 miles and it has no exit.” (R. Hartmann)	http://pleiades.stoa.org/places/697709		ثم صورت الشام واجناده وجباله ومياهه من انهاره وبحره وما على ساحله من المدن وبحيرة طبرية وبحيرة زغر وتيه بنى اسرآئيل وموقعه منه	http://syriaca.org/bibl/GZIUD38F	8																Dead Sea 	Buḥaira Zughar 	Baḥr Lūṭ 	al-Buḥaira al-Muntina 	al-Buḥaira al-Mayyita 	al-Buḥaira al-Maqlūba								بحيرة زغر 	بحر لوط 	البحيرة المنتنة 	البحيرة الميتة 	البحيرة المقلوبة	بحيرة زغر	http://syriaca.org/bibl/GZIUD38F	8																														
5273	1	5273D1	mosque	A mosque in Medina.	https://tools.wmflabs.org/geohack/geohack.php?language=ar&pagename=مسجد_ذي_الحليفة&params=24_29_02.71_N_39_34_44.07_E_region:SA_type:landmark																				Dhū al-Ḥulayfa													ذو الحليفة					ذو الحليفة	http://syriaca.org/bibl/WDUISTPU	189																														
5274	1	5274D1	unknown	A valley in the vicinity of Mecca.																					Dhū Ṭawī 	Wādī Dhū Ṭawī												ذو طوي 	وادي ذي طوي				ذو طوي	http://syriaca.org/bibl/QVIUC5ZC	156										وادي ذي طوي	http://syriaca.org/bibl/WDUISTPU	112																		
5275	1	5275D1	settlement	A town in the Wādī Qurra between Medina and Tabūk.																					Diyār Thamūd													ديار ثمود					ديار ثمود	http://syriaca.org/bibl/QVIUC5ZC	127																														
5276	1	5276D1	river	“[T]he largest river in southern Persia. It rises in the north-eastern part of the district of ʿArabistān (earlier called K̲h̲ūzistān), a little above Lat. 32º N. on the Zarda-Kūh, which belongs to the Bak̲h̲tiyārī mountain system or, to be more accurate, on one of the ranges named Kūh-i Rang, one of the highest mountains in south-western Persia (estimated at 13,000 feet).” (M. Streck/J. Lassner)	http://pleiades.stoa.org/places/912879																				Dujayl 	Kārūn 	Pasitigris											دجيل 	كارون				دجيل	http://syriaca.org/bibl/WDUISTPU	231, 232																														
5277	1	5277D1	settlement	A city located at the Amu Darya (Jayhūn) located in current-day Turkmenistan.	http://sws.geonames.org/1219431		فربر مدينة على جيحون	http://syriaca.org/bibl/Q7SV98GA	27																Farbar 	Farap												فربر					فربر	http://syriaca.org/bibl/Q7SV98GA	27																														
5278	1	5278D1	settlement	A town in Iran.																					Farghān													فرغان					فرغان	http://syriaca.org/bibl/QVIUC5ZC	240																														
5279	1	5279D1	settlement	Fasā is a city located 164 km from Shiraz close to the Persian/Arabian Gulf. It “is situated in 28° 56′ N. Lat. and 53° 39′ E. Long. (Greenwich); it is 1,561 metres above sea level.” (Lockhart)	http://pleiades.stoa.org/places/29781					وافراوه رباط نسا (فسا)	http://syriaca.org/bibl/Q7SV98GA	27													Fasā 	Basā 	Pasā	Fassa 	Fasa									بَسا	فسا				بَسا	http://syriaca.org/bibl/QVIUC5ZC	661										فسا	http://syriaca.org/bibl/Q7SV98GA	27																		
5280	1	5280D1	settlement	A town southwest of Hamadān.	https://tools.wmflabs.org/geohack/geohack.php?pagename=Firuzan&params=34_16_43_N_48_14_24_E_region:IR_type:city																				Fīrūzān 	Firuzan												فيروزان					فيروزان	http://syriaca.org/bibl/QVIUC5ZC	210																														
5281	1	5281D1	settlement	A village in the Tihāma close to Zabīd in Yemen.																					Ghassāna													غسانة					غسانة	http://syriaca.org/bibl/QVIUC5ZC	257																														
5282	1	5282D1	province	A province located next to Bust province in the region of Kābulistan.	http://sws.geonames.org/1141268		واما بست فانها اسم القصبة ايضا ومن مدنها جهالكان، بان، قرمة، بوزاد، ارض داور، صروستان، قرية الجوز، رخود، بكراواذ، بنجوى، كش، روذان، سفنجاوى، طلقان ولها الف ومائة قرية ومن هذه المدن ما يضاف الى سجستان وهو خطأ واقل من يميزهن تمييزنا وابو زيد جعل غزنين وبست من سجستان ومن الناس من يجعلهما كورة واحدة ويسميها كابلستان.	http://syriaca.org/bibl/Q7SV98GA	297																Ghaznīn													غزنين					غزنين	http://syriaca.org/bibl/Q7SV98GA	297																														
5283	1	5283D1	settlement	A city located along the Mediteranean coast of North Africa.	http://pleiades.stoa.org/places/295267		وشرشال مدينة قديمة ازلية قد خربت وفيها مرسى وفيها آثار قديمة واصنام من حجارة ومبان عظيمة، ومنها الى برشك مدينة كان عليها سور	http://syriaca.org/bibl/GZIUD38F	52																Gouraya 	Barshak 	Qūrāya											برشك 	قوراية				برشك	http://syriaca.org/bibl/GZIUD38F	52																														
5284	1	5284D1	unknown	A “deep valley running parallel to the southern coast of Arabia from roughly 48° E. to 50° E., between precipitous walls rising to a high plateau (the Djol), which on the south separates it from the narrow coastal plain and on the north from an arid tract merging into the sand desert of the Empty Quarter of Arabia.” (Beeston)	http://gazetteer.dainst.org/place/2402351																				Ḥadramaut													حضرموت					حضرموت	http://syriaca.org/bibl/QVIUC5ZC	267																														
5285	1	5285D1	region	“The name Ḥaḍramawt is applicable in its strictest sense to the deep valley running parallel to the southern coast of Arabia from roughly 48° E. to 50° E., between precipitous walls rising to a high plateau (the Djol), which on the south separates it from the narrow coastal plain and on the north from an arid tract merging into the sand desert of the Empty Quarter of Arabia.” (A.F.L. Beeston)	http://sws.geonames.org/75411		ويحيط بها بحر فارس من عبادان وهو مصب ماء دجلة في البحر فيمتد على البحرين حتى ينتهى الى عمان ثم يعطف على سواحل مهرة وحضرموت وعدن حتى ينتهى الى سواحل اليمن الى جدة ثم يمتدعلى الجار ومدين حتى ينتهي الى أيلة	http://syriaca.org/bibl/GZIUD38F	17																Ḥadramawt													حضرموت					حضرموت	http://syriaca.org/bibl/GZIUD38F	17																														
5286	1	5286D1	settlement	A city in Najrān.			وقال ابن الحائك : الهجر بلغة حمير والعرب العاربة القرية، فمنها : هجر البحرين وهجر نجران وهجر جازان وهجر حصنة من مخلاف مازن؛ وهجر : مدينة وهي قاعدة البحرين، وربما قيل الهجر، بالألف واللام	http://syriaca.org/bibl/ZQCZ554T	vol. 5, p. 393																Hajar													هَجَرُ					هجر	http://syriaca.org/bibl/ZQCZ554T	vol. 5, p. 393																														
5287	1	5287D1	settlement	A city in Jāzān.			وقال ابن الحائك : الهجر بلغة حمير والعرب العاربة القرية، فمنها : هجر البحرين وهجر نجران وهجر جازان وهجر حصنة من مخلاف مازن؛ وهجر : مدينة وهي قاعدة البحرين، وربما قيل الهجر، بالألف واللام	http://syriaca.org/bibl/ZQCZ554T	vol. 5, p. 393																Hajar													هَجَرُ					هجر	http://syriaca.org/bibl/ZQCZ554T	vol. 5, p. 393																														
5288	1	5288D1	fortification	A fortification in the province (mikhlāf) of Māzan.			وقال ابن الحائك : الهجر بلغة حمير والعرب العاربة القرية، فمنها : هجر البحرين وهجر نجران وهجر جازان وهجر حصنة من مخلاف مازن؛ وهجر : مدينة وهي قاعدة البحرين، وربما قيل الهجر، بالألف واللام	http://syriaca.org/bibl/ZQCZ554T	vol. 5, p. 393																Hajar													هَجَرُ					هجر	http://syriaca.org/bibl/ZQCZ554T	vol. 5, p. 393																														
5289	1	5289D1	region	A region (nāḥiya) in al-Baḥrayn.			وقيل : ناحية البحرين كلها هجر، وهو الصواب، قال ابن الكلبي عن الشرقي : إنما سميت عين هجر بهجر بنت المكفف وكانت من العرب المتعربة وكان زوجها محلم بن عبد الله صاحب النهر الذي بالبحرين يقال له نهر محلم وعين محلم [...]	http://syriaca.org/bibl/ZQCZ554T	vol. 5, p. 393																Hajar													هَجَرُ					هجر	http://syriaca.org/bibl/ZQCZ554T	vol. 5, p. 393																														
5290	1	5290D1	settlement	A village (qarya) close to Medina.			وقيل : هجر قرية قرب المدينة، وقال : بل عملت بالمدينة على مثل قلال هجر	http://syriaca.org/bibl/ZQCZ554T	vol. 5, p. 393																Hajar													هَجَرُ					هجر	http://syriaca.org/bibl/ZQCZ554T	vol. 5, p. 393																														
5291	1	5291D1	settlement	A province (bilād) whose adminstrative center (qaṣaba) is al-Ṣafā.			وقال قوم : هجر بلاد قصبتها الصفا، وقد ذكرت في موضعها، بينها وبين اليمامة عشرة أيام، وبينها وبين البصرة خمسة عشر يوما على الإبل، وقد ذكر قوم من أهل الأدب أن هجر لا تدخله الألف واللام [...]	http://syriaca.org/bibl/ZQCZ554T	vol. 5, p. 393																Hajar													هَجَرُ					هجر	http://syriaca.org/bibl/ZQCZ554T	vol. 5, p. 393																														
5292	1	5292D1	settlement	A town in Yemen.																					Ḥallī													حَلي					حَلي	http://syriaca.org/bibl/QVIUC5ZC	254																														
5293	1	5293D1	province	A district (kūra) in ʿIrāq.	http://pleiades.stoa.org/places/903043		حلوان كورة بالعراق ومدينة بمصر وقرية بنيسابور واخرى بقوهستان	http://syriaca.org/bibl/Q7SV98GA	25																Ḥalwān													حلوان					حلوان	http://syriaca.org/bibl/Q7SV98GA	25																														
5294	1	5294D1	settlement	A city (madīna) in Egypt.	http://www.geonames.org/355795/halwan.html		حلوان كورة بالعراق ومدينة بمصر وقرية بنيسابور واخرى بقوهستان	http://syriaca.org/bibl/Q7SV98GA	25																Ḥalwān													حلوان					حلوان	http://syriaca.org/bibl/Q7SV98GA	25																														
5295	1	5295D1	settlement	A village (qarya) in Nīsābūr.			حلوان كورة بالعراق ومدينة بمصر وقرية بنيسابور واخرى بقوهستان	http://syriaca.org/bibl/Q7SV98GA	25																Ḥalwān													حلوان					حلوان	http://syriaca.org/bibl/Q7SV98GA	25																														
5296	1	5296D1	settlement	A village (qarya) in Qūhistān.			حلوان كورة بالعراق ومدينة بمصر وقرية بنيسابور واخرى بقوهستان	http://syriaca.org/bibl/Q7SV98GA	25																Ḥalwān													حلوان					حلوان	http://syriaca.org/bibl/Q7SV98GA	25																														
5297	1	5297D1	building	One of the bathhouses in Mecca.																					Ḥamām al-Mayānishī													حمام الميانشي					حمام الميانشي	http://syriaca.org/bibl/WDUISTPU	124																														
5298	1	5298D1	building	One of the bathhouses in Mecca.																					Ḥamām Jamāl al-Dīn													حمام جمال الدين					حمام جمال الدين	http://syriaca.org/bibl/WDUISTPU	124																														
5299	1	5299D1	region	A city or region in southern Iran close to Lār and Bāl.	https://goo.gl/maps/tYLfF4JnA69Kfs4G8 (village in southern Iran)																				Hanj													هنج					هنج	http://syriaca.org/bibl/QVIUC5ZC	217																														
5300	1	5300D1	settlement	A village in al-ʿIrāq near Tikrīt.																					Ḥarba													حربة					الحربة	http://syriaca.org/bibl/WDUISTPU	232										حربة	http://syriaca.org/bibl/QVIUC5ZC	243																		
5301	1	5301D1	region	“[R]egion of southern Syria bounded to the east by the volcanic massif of the D̲j̲abal al-Durūz, to the north by the plateau of the Lad̲j̲āʾ and the Damascus plain, to the west by D̲j̲awlān [q.v.] and to the south by the Yarmūk, a region which | corresponds roughly to the administrative area, or liwāʾ , of the same name and which extends for about 100 kilometres from north to south and 75 from east to west.” (D. Sourdel)	http://pleiades.stoa.org/places/678295		وجنوبيها [من ديار العرب] وشيء من غربيهاثم يمتد عليها من ايلة على مدائن قوم لوط والبحيرة المنتنة التي تعرف ببحيرة زغر الى الشراة والبلقاء وهي من عمل فلسطين وأذرعات وحوران والبثنية والغوطة ونواحى بعلبك وذلك من عمل دمشق	http://syriaca.org/bibl/GZIUD38F	17																Ḥawārān 	Ḥawrān												حوران					حواران	http://syriaca.org/bibl/GZIUD38F	17																														
5302	1	5302D1	region	One of the jānibs of the Mashriq (Sijistān, Khurāsān, Transoxania) located in its south. Its miṣr is Samarqand. (A. Miquel)			السوس كورة باقصى المغرب ومدينة باوله واخرى بهيطل وكورة بخوزستان وبالمغرب سوسة ايضا	http://syriaca.org/bibl/Q7SV98GA	24																Hayṭal													هيطل					هيطل	http://syriaca.org/bibl/Q7SV98GA	24																														
5303	1	5303D1	quarter	A market and quarter in Mecca.	https://tools.wmflabs.org/geohack/geohack.php?language=ar&pagename=الحزورة&params=21_25_18.3_N_39_49_33.6_E_type:city_region:SA																				Ḥazwara													حزورة					حزورة	http://syriaca.org/bibl/WDUISTPU	105																														
5304	1	5304D1	settlement	A place (mauḍiʿ) in al-Baḥrayn.			هدن : [...] موضع بالبحرين.	http://syriaca.org/bibl/ZQCZ554T	vol. 5, p. 395																Hidn													هِدْنٌ					هدن	http://syriaca.org/bibl/ZQCZ554T	vol. 5, p. 395																														
5305	1	5305D1	fortification	A fortress near Sāmarrāʾ in al-ʿIrāq.																					Ḥiṣn al-Maʿshūq													حصن المعشوق					حصن المعشوق	http://syriaca.org/bibl/WDUISTPU	232																														
5306	1	5306D1	fortification	A former fortress in Medina.																					Ḥiṣn al-ʿUzzāb													حصن العزاب					حصن العزاب	http://syriaca.org/bibl/WDUISTPU	198																														
5307	1	5307D1	settlement	A “town in ʿIrāḳ situated in about 33° 35′ N. and 42° 48′ E. on the right bank of the Euphrates, on a hill which may be man-made.” (Streck)	http://pleiades.stoa.org/places/894008																				Hīt 	Idu 	Diacira											هيت					هيت	http://syriaca.org/bibl/QVIUC5ZC	663																														
